{
  "$schema": "https://json-schema.org/draft/2020-12/schema",
  "$id": "https://influencer-os.local/schemas/research-watchlist.schema.json",
  "title": "ResearchWatchlist",
  "type": "object",
  "additionalProperties": false,
  "required": [
    "research_watchlist_id",
    "creator_profile_id",
    "updated_on",
    "items"
  ],
  "properties": {
    "research_watchlist_id": {
      "type": "string",
      "pattern": "^research_watchlist_[a-zA-Z0-9_-]+$"
    },
    "creator_profile_id": {
      "type": "string",
      "pattern": "^creator_[a-zA-Z0-9_-]+$"
    },
    "updated_on": {
      "type": "string",
      "format": "date"
    },
    "items": {
      "type": "array",
      "items": {
        "type": "object",
        "additionalProperties": false,
        "properties": {
          "watchlist_item_id": {
            "type": "string",
            "pattern": "^watchlist_[a-zA-Z0-9_-]+$"
          },
          "target_type": {
            "type": "string",
            "enum": [
              "creator",
              "hashtag",
              "search_term",
              "source",
              "topic"
            ]
          },
          "target_ref": {
            "type": "string",
            "minLength": 1
          },
          "user_approved": {
            "type": "boolean"
          },
          "platform": {
            "type": "string",
            "enum": [
              "x",
              "instagram",
              "tiktok",
              "substack",
              "medium",
              "reddit",
              "facebook",
              "linkedin",
              "youtube"
            ]
          },
          "creator_profile_id": {
            "type": "string",
            "pattern": "^creator_[a-zA-Z0-9_-]+$"
          },
          "usefulness_score": {
            "type": "integer",
            "minimum": 0,
            "maximum": 100
          },
          "status": {
            "type": "string",
            "enum": [
              "candidate",
              "active",
              "flagged_for_removal",
              "retired"
            ]
          },
          "added_on": {
            "type": "string",
            "format": "date"
          },
          "updated_on": {
            "type": "string",
            "format": "date"
          },
          "last_evaluated_on": {
            "type": "string",
            "format": "date"
          },
          "rationale": {
            "type": "string",
            "minLength": 1
          }
        },
        "required": [
          "watchlist_item_id",
          "target_type",
          "target_ref",
          "user_approved",
          "creator_profile_id",
          "usefulness_score",
          "status",
          "added_on",
          "updated_on",
          "last_evaluated_on",
          "rationale"
        ]
      }
    }
  }
}
